Carimbo de data/hora,Eixo temático,Título do trabalho,Resumo,Palavra-chave 1,Palavra-chave 2,Palavra-chave 3,Palavra-chave 4,Palavra-chave 5
06/07/2023 18:30:04,Eixo Temático 4 - Gestão E Políticas Educacionais no contexto das TDIC,GOOGLE DRIVE: USOS E CONTRIBUTOS NA QUALIFICAÇÃO DOS PROCESSOS EDUCATIVOS,"O presente trabalho tem como objetivo apresentar a experiência desenvolvida com o uso da ferramenta Google Drive no âmbito da gestão do departamento pedagógico do sistema municipal de ensino de um município catarinense. A base teórica contou com autores do campo, dentre esses citamos ARANHA (2018); LOPES e MELO (2014); SELWYN (2008); SOUSA, MIOTA, CARVALHO (2011). A metodologia consistiu na coleta de dados a partir da experiência de uso da ferramenta em três etapas: 1) equipe do departamento pedagógico da secretaria de educação; 2) gestores das unidades da educação infantil e do ensino fundamental; e 3) profissionais (professores, supervisores, orientadores, administradores e secretários) das unidades de ensino da educação infantil e do ensino fundamental. Os resultados apontaram para uma melhora significativa na operacionalização tanto do trabalho pedagógico, bem como, do trabalho em âmbito administrativo. Concluiu-se que, a ferramenta Google Drive se constitui em uma grande aliada na organização e otimização do trabalho pedagógico e administrativo nos sistemas públicos de ensino.

",GoogleDrive,Organização Pedagógica,Educação Básica ,Sistema Municipal Público de Ensino, Gestão Educacional
06/07/2023 18:31:10,Eixo Temático 4 - Gestão E Políticas Educacionais no contexto das TDIC,INCLUSÃO DIGITAL NA UFSM: REFLEXÕES SOBRE AS AÇÕES OPORTUNIZADAS PELA ASSISTÊNCIA ESTUDANTIL,"Este trabalho problematiza a inclusão digital oportunizada pela Assistência Estudantil na Universidade Federal de Santa Maria (UFSM). Apresenta recortes de investigação vinculada à LP1 (Políticas e Gestão da Educação Básica e Superior) do Mestrado Profissional em Políticas Públicas e Gestão Educacional da UFSM, fundamentada no Decreto nº 7.234 de 19 de julho de 2010, que se configura no Programa Nacional de Assistência Estudantil (PNAES), cuja finalidade é ampliar as condições de permanência dos jovens na educação superior pública. Centraliza a discussão nas ações de inclusão digital que fazem parte das previsões do Programa para garantir a permanência dos estudantes. Tal debate encontrou visibilidade e se tornou importante a partir do contexto mundial enfrentado em decorrência da pandemia de Coronavírus (SARS-CoV-2) e da adoção do ensino remoto pelas Instituições Federais de Ensino Superior. Com este contexto, busca-se apresentar uma breve síntese da pesquisa em andamento. Numa perspectiva metodológica qualitativa, que se configura em um Estudo de Caso, cujos dados estão sendo analisados por meio de Análise Textual Discursiva. Verifica-se que a inclusão digital oportunizada pela Assistência Estudantil ainda precisa ser refletida e discutida, pois demonstra ser um dispositivo importante em apoio às demais ações para a permanência dos estudantes e garantia do direito à educação.

",Políticas Públicas, Educação Superior,Inclusão digital,ND,ND
06/07/2023 18:32:33,Eixo Temático 4 - Gestão E Políticas Educacionais no contexto das TDIC,INSTITUCIONALIZAÇÃO DA EDUCAÇÃO A DISTÂNCIA COMO OBJETO DE PESQUISA: UMA ANÁLISE A PARTIR DE TESES EM EDUCAÇÃO,"O objetivo deste texto foi verificar, na produção científica, como é abordada a institucionalização da Educação a Distância (EaD) no Brasil.  Derivado da Teoria Institucional, o conceito “institucionalização” busca explicar as interações entre organizações e seu ambiente. Quando evocado em análises no campo da EaD, pode ser compreendido como um processo contínuo, complexo e progressivo de incorporação da modalidade às estruturas e à cultura das universidades. Tal processo envolve elementos exógenos, relativos às pressões que o ambiente exerce sobre as instituições, e endógenos, referentes às adaptações realizadas internamente pelas universidades para atender a essas pressões. O estudo envolveu a análise de dados bibliométricos oriundos de uma Base de Teses com mais de seis mil pesquisas de doutorado de Programas de Pós-Graduação em Educação brasileiros. Dentre os principais resultados, apontou-se que o Sistema Universidade Aberta do Brasil (UAB) atuou como um elemento coercitivo na institucionalização da EaD. Observou-se, também, que a oferta de cursos EaD nas universidades públicas parece não estar sendo acompanhada por mudanças estruturais e, tampouco, culturais significativas. Por fim, ressaltou-se que o aumento considerável da oferta de cursos a distância não se refletiu numa ampla produção científica sobre a temática da institucionalização da EaD, resultando na escassez de informações que possam embasar a gestão da modalidade.

",Educação a Distância ,Institucionalização,Bibliometria,Universidade Aberta do Brasil,ND
06/07/2023 18:33:08,Eixo Temático 4 - Gestão E Políticas Educacionais no contexto das TDIC,LAB IFMAKER: CONCEPÇÕES INSTITUCIONAIS DE UMA POLÍTICA PÚBLICA A SER IMPLEMENTADA NA REDE FEDERAL DE EDUCAÇÃO PROFISSIONAL E TECNOLÓGICA,"O Governo Federal, por meio do Ministério da Educação e da Secretaria de Educação Profissional e Tecnológica, está fomentando a criação de laboratórios de prototipagem nas instituições que compõem a Rede Federal de Educação Profissional, Científica e Tecnológica. Também denominados laboratórios maker, estes espaços tem a proposta de inserir os princípios da cultura maker no contexto educacional, visando melhorias no ensino e na formação dos estudantes. A educação maker consiste numa abordagem pedagógica centrada no “aprender fazendo”, que defende a aprendizagem a partir da construção de objetos e com o suporte de recursos tecnológicos. Nesse contexto, o presente trabalho realizou uma análise de conteúdo referente aos projetos aprovados pelo Instituto Federal do Triângulo Mineiro no edital de chamada pública, e buscou analisar as concepções institucionais sobre o tema, bem como as contribuições vislumbradas pelas propostas no que se refere ao Ensino Superior. Concluiu-se, que as concepções institucionais estão alinhadas com os principais conceitos que estruturam a discussão sobre o movimento maker no contexto educacional. Além disso, foram identificadas possíveis contribuições dos espaços maker para o Ensino Superior, como promover a verticalização do ensino na instituição, integrando cursos e níveis diferentes de ensino, e possibilitar a contextualização e interdisciplinaridade entre os conteúdos e áreas do conhecimento.

",Educação Maker,Prototipagem,Ensino Superior,ND,ND
06/07/2023 18:33:47,Eixo Temático 4 - Gestão E Políticas Educacionais no contexto das TDIC,"MODELO DE FORMAÇÃO (MODFOR): UMA PROPOSTA DE AÇÃO PARA A POLÍTICA DE ASSISTÊNCIA ESTUDANTIL DO INSTITUTO FEDERAL DE EDUCAÇÃO, CIÊNCIA E TECNOLOGIA DE SÃO PAULO","Este artigo visa apresentar aspectos da Política de Assistência Estudantil (PAE) do Câmpus Avançado Ilha Solteira do Instituto Federal de Educação, Ciência e Tecnologia de São Paulo (IFSP-IST). A PAE é uma ação afirmativa de atendimento aos estudantes do IFSP-IST que visa contribuir para a promoção do acesso, permanência e do processo formativo do estudante, em uma perspectiva de equidade, produção do conhecimento e melhoria do desempenho escolar. Para tanto, o objetivo é apresentar a PAE no IFSP-IST considerando os olhares dos estudantes da instituição e sua relação com a manutenção de seu direito à educação, coletados por meio do questionário de avaliação da PAE aplicados entre 2019 e 2020. As análises quantiqualitaivas dos resultados, somadas aos aportes teóricos de autores que tratam do direito à Educação e implementação da Política de Assistência Estudantil, demonstraram que os discentes do IFSP-IST, em sua maioria, reconhecem a referida política somente como uma ajuda financeira da instituição. Apoiados no construto freiriano do “inédito viável”, propomos o Modelo de Formação (MODFOR) para a comunidade interna do IFSP-IST, a fim de ampliar a compreensão da PAE como ação política, social e educacional de manutenção de direitos e de promoção da equidade na educação.

", Política de Assistência Estudantil,Direito à Educação,Modelo de Formação,ND,ND
06/07/2023 18:34:20,Eixo Temático 4 - Gestão E Políticas Educacionais no contexto das TDIC,NAPP ACADEMY: PROGRAMA DE INCENTIVO À EDUCAÇÃO TECNOLÓGICA – UM ESTUDO DE CASO,"O apagão da mão de obra qualificada na área de tecnologia da informação se demonstrou um grande problema para as empresas desse segmento, desde startups até grandes empresas. Portanto, o objetivo deste trabalho é apresentar como o programa de incentivo à educação tecnológica, Napp Academy, proporcionado pela empresa de tecnologia Napp Solutions, está propondo solucionar essa carência. Para tal, buscou-se trabalhar com metodologias ágeis, a fim de gerar eficiência e velocidade na geração de profissionais que possam trabalhar com os pré-requisitos mínimos exigidos pela empresa Napp Solutions no setor técnico. E por fim, por meio deste programa, foi possível concluir até o momento deste estudo de caso, que a carência da mão de obra interna da empresa Napp Solutions está sendo sanada de maneira eficiente.

",tecnologia,educação,trabalho,Napp Academy,carência
06/07/2023 18:35:22,Eixo Temático 4 - Gestão E Políticas Educacionais no contexto das TDIC,O ENSINO REMOTO EMERGENCIAL NA EDUCAÇÃO PROFISSIONAL E TECNOLÓGICA: O CASO DO IF SUDESTE MG,"No ano de 2020 o mundo estremeceu por uma crise epidemiológica causada pela doença Covid-19, forçando muitos setores socioeconômicos a se (re)inventarem, inclusive as Instituições de Ensino, mediante as medidas cautelares de distanciamento e isolamento. Como consequência,  o IF Sudeste MG suspendeu suas atividades presenciais no dia 17 de março de 2020 e, meses depois, implantou o Ensino Remoto Emergencial (ERE). Nesse contexto, este estudo tem por objetivo provocar uma reflexão sobre os desafios do processo de implementação do ERE para a EPT. Para tanto, utilizamos a metodologia exploratória, de caráter bibliográfico, associado ao estudo de caso. Os resultados apontam que a implantação do ERE foi uma medida emergencial para a permanência e manutenção das atividades escolares e como ação de apoio emocional, social e econômica para estudantes, servidores e familiares. Conclui-se que, o ERE foi planejado para que o acesso e a permanência à educação pudessem ter continuidade, mantendo-se o vínculo do aluno com a Instituição e evitando-se a evasão. O ERE trouxe, e ainda trará, mudanças significativas para as políticas institucionais, provocando abertura ao diálogo sobre o assunto com possibilidade da inserção desta nova metodologia flexível de ensino a nível nacional por meio de modelos híbridos.

",Educação Profissional e Tecnológica,Tecnologia de Informação e Comunicação,Ensino Híbrido,Práticas-Pedagógicas,ND
06/07/2023 18:36:10,Eixo Temático 4 - Gestão E Políticas Educacionais no contexto das TDIC,O MODELO DA COMUNIDADE DE INQUIRIÇÃO COMO APOIO NA PERMANÊNCIA ACADÊMICA EM CURSOS SUPERIORES MEDIADOS POR TECNOLOGIA,"Os cursos superiores mediados por tecnologia ainda estão em expansão e isso aumenta ainda mais a preocupação por parte dos gestores das Universidades em relação ao baixo índice de permanência dos acadêmicos nesses cursos. Na busca pelo apoio na tomada de decisões que maximizem essa permanência, encontrou-se no modelo da Comunidade de Inquirição - CoI uma base para um estudo mais aprofundado sobre essa temática, considerando que é um modelo pensado para ambientes mediados por tecnologia. Assim, com as diretrizes estabelecidas pelo CoI e considerando também as informações disponíveis no Ambiente Virtual de Aprendizagem – AVA, especialmente no que se refere à forma como os acadêmicos e professores interagem no ambiente, somada a percepção dos gestores e professores dos cursos mediados por tecnologia em relação a essa temática, procura-se identificar uma metodologia que auxiliará na elaboração de um plano de permanência para os cursos superiores mediados por tecnologia.

",permanência,Ensino Superior,tecnologia,gestão,ND
06/07/2023 18:36:47,Eixo Temático 4 - Gestão E Políticas Educacionais no contexto das TDIC,O PROCESSO ELETRÔNICO NACIONAL E SUA POTENCIALIDADE PARA AS AÇÕES DA ASSISTÊNCIA ESTUDANTIL NA UFSM,"O cenário de emergência em relação à pandemia da Covid-19 vivenciado desde 2020 em contexto global demonstrou a necessidade de modificação nos modos de vida, nas relações sociais e nos processos de trabalho. O presente texto objetiva relatar a experiência de migração do processo de solicitação de auxílios relacionados à política institucional de Assistência Estudantil  da Universidade Federal de Santa Maria (UFSM) para o Processo Eletrônico Nacional (PEN) e refletir acerca da potencialidade de medidas no campo da inclusão digital, como oportunidade de acesso aos estudantes em vulnerabilidade social aos seus direitos. Trata-se de pesquisa com abordagem qualitativa, bibliográfica, documental e com observação participante dos autores que são Técnico-Administrativos em Educação (TAES), em processo de qualificação profissional, vinculados à Programas de Mestrado Profissional e Doutorado da Instituição. Fundamenta-se em autores que discutem a inclusão digital, o Plano Nacional de Assistência Estudantil e as diretrizes sobre o PEN.  Conclui-se que a adoção do PEN, apesar de ser um desafio para os estudantes e para a gestão, se constitui em uma medida importante de inclusão digital, que tem possibilitado o acesso dos estudantes aos auxílios proporcionados pela Assistência Estudantil da UFSM e, por ser realizado de maneira online, torna-se seguro e confiável tendo em vista os meios de autenticidade do sistema.

",Políticas públicas,Educação superior,Gestão de processo, Inclusão digital,ND
06/07/2023 18:37:25,Eixo Temático 4 - Gestão E Políticas Educacionais no contexto das TDIC,PERFIL DOS ALUNOS COM DEFICIÊNCIA INGRESSANTES NOS CURSOS DE GRADUAÇÃO EM UMA INSTITUIÇÃO DE ENSINO SUPERIOR E SUA TRAJETÓRIA ACADÊMICA: UMA ANÁLISE DE DADOS,"O número de alunos com deficiência no ensino superior tem crescido nos últimos anos. Fatores que contribuíram para esse crescimento, destaca-se a Lei nº 13.409. O objetivo do estudo foi conhecer e analisar o processo de inclusão dos alunos com deficiência em uma instituição federal de ensino superior (IFES). Trata-se de um estudo transversal, observacional, retrospectivo exploratório de caráter quantitativo a partir da análise de banco de dados secundários da graduação da IFES entre 2001 e 2020 desses estudantes, disponibilizado pelo órgão responsável. A amostra foi composta por 1130 alunos, sendo que destes, 54,2% entraram antes da reserva de vagas para pessoa com deficiência (2001 à 2017) e 45,8% dos alunos entraram após a implementação da reserva de vagas (2018 a 2020). Nota-se mudança no perfil dos alunos, antes e após reserva de vagas. A formação em nível superior é fundamental para identidade e inserção no mercado de trabalho. Nota-se necessidade de implementações para direcionar políticas inclusivas na instituição para permanência efetiva e conclusão dos cursos pelos alunos com deficiência.

",Aluno com deficiência;,Ensino superior,Inclusão,ND,ND
06/07/2023 18:38:21,Eixo Temático 4 - Gestão E Políticas Educacionais no contexto das TDIC,PERMANÊNCIA E EVASÃO NA EDUCAÇÃO A DISTÂNCIA: IDENTIFICAÇÃO DE FATORES CRÍTICOS DE SUCESSO,"A Educação a Distância cresce de forma significativa no Brasil, contudo, enfrenta problemas em sua gestão, a exemplo das dificuldades para garantir a permanência acadêmica e evitar a evasão discente. Esta investigação tem como objetivo identificar os Fatores Críticos de Sucesso que afetam a permanência e a evasão em um curso de graduação em Administração, modalidade a distância. Trata-se de um estudo descritivo-exploratório, de abordagem quali-quantitativa, de natureza aplicada e com procedimentos de pesquisa bibliográfica, levantamento de campo, estudo de caso e pesquisa ex-post-facto. A amostra será do tipo não probabilística, definida pelo critério de acessibilidade. A coleta de dados será realizada por meio de fichas eletrônicas, questionários, formulários e entrevistas semiestruturadas. Após a coleta, os dados serão analisados por meio da estatística descritiva e da técnica de Análise de Conteúdo. Espera-se, a partir dos resultados observados, elaborar um plano de ação estratégico que auxilie na retenção discente em cursos on-line.

",Educação  a  Distância, Estratégia  de  Retenção  Educacional,Evasão  no  Ensino Superior,Fatores Críticos de Sucesso,ND
06/07/2023 18:38:53,Eixo Temático 4 - Gestão E Políticas Educacionais no contexto das TDIC,REFLEXÕES SOBRE A DISCIPLINA DE TECNOLOGIA E INOVAÇÃO NO NOVO ENSINO MÉDIO: O QUE APONTA OS DOCUMENTOS OFICIAIS EM MINAS GERAIS?,"O presente trabalho explicita algumas reflexões a respeito da disciplina de Tecnologia e Inovação inserida na matriz curricular do Novo Ensino Médio (NEM) nas escolas públicas estaduais de Minas Gerais. Pautado em uma análise documental do Currículo Referência de Minas Gerais (CRMG) e nos cadernos orientadores do NEM, buscamos problematizar a referida disciplina que vem trazendo implicações na formação dos indivíduos matriculados nesta etapa de escolarização. A referida disciplina, após uma análise dos documentos sociais, reduz a compreensão de tecnologia às ferramentas digitais, o que pode ser um implicador no que tange a compreensão deste conceito e suas implicações nos contextos educativos. Além disso, percebe-se uma falta de formação docente dos responsáveis por essa disciplina, o que pode fragilizar ainda mais a profissão.

", Novo Ensino Médio,Tecnologias,Profissão Docente,ND,ND
06/07/2023 18:39:33,Eixo Temático 4 - Gestão E Políticas Educacionais no contexto das TDIC,RETRATO DA INSTITUCIONALIZAÇÃO DA EAD NA REDE EPT - 2021,"Este artigo tem como objetivo apresentar o retrato da institucionalização da EaD na Rede Federal de Educação Profissional, cuja pesquisa foi realizada em 2021 pelo Grupo de Trabalho de EaD criado pelo Conselho Nacional de Instituições da Rede Federal de Educação Profissional, Científica e Tecnológica (Conif). Como metodologia do presente estudo, utilizou-se o procedimento técnico de levantamento, por meio de um questionário para a Rede Federal, que foi respondido por todas as 41 instituições representadas pelo Conif e mais duas Escolas Técnicas vinculadas à Universidades, totalizando 43 respondentes. Como resultado, foi observado um importante avanço na Rede no que tange o processo de institucionalização, especialmente em relação ao número de cursos a distância, de alunos, de disciplinas a distância em cursos presenciais, de campi das instituições atuando como polos, no uso diversificado de metodologias e uma significativa atuação dos núcleos gestores de EaD durante a pandemia. Como aspectos a melhorar destacam-se a necessidade de maior estruturação dos núcleos gestores de EaD, com a contratação de mais profissionais efetivos e com mais funções gratificadas, mais esforços em pesquisa e extensão nos cursos a distância e a minimização de resistências internas e externas à modalidade.

",Educação   a   Distância, Institucionalização   da   EaD,Rede   Federal   de   Educação Profissional e Tecnológica,Conif,ND
06/07/2023 18:40:05,Eixo Temático 4 - Gestão E Políticas Educacionais no contexto das TDIC,SISTEMA PÚBLICO MUNICIPAL E TDIC: A FALTA DE EQUIDADE NA EDUCAÇÃO REVELADA EM TEMPO PANDÊMICO,"Os dados educacionais no Brasil nunca foram promissores e essa realidade foi agravada pelo distanciamento dos alunos de seus ambientes escolares, causando danos ainda não mensurados pela ciência. O objeto de estudo deste trabalho é o sistema público municipal de ensino e o uso das TDIC no contexto escolar, tendo como objetivo discutir, analisar e refletir as interferências causadas pelo distanciamento escolar nos anos iniciais do ensino fundamental. O interesse por abordar essa questão partiu de experiências educacionais dos autores antes, durante e após período pandêmico, tendo como vertente as políticas educacionais. A abordagem metodológica é a teórica exploratória considerados três eixos estruturantes: aprendizagem, equidade e tecnologias digitais, que se fundamentam em autores e legislações que indicam o uso das tecnologias no processo de ensino e aprendizagem. Os resultados apontam a fragilidade do sistema público e dos alunos inseridos em virtude da escassez do uso de tecnologias, recursos e linguagens digitais; o despreparo das escolas, professores, famílias e alunos a uma nova forma de ensinar e aprender.  Os desafios enfrentados devem servir de trampolim para aprimorar as políticas educacionais e garantir o direito à aprendizagem de todos os alunos, mediados por tecnologias digitais.

",sistema público municipal;,TDIC,equidade,políticas educacionais,ND
06/07/2023 18:40:40,Eixo Temático 4 - Gestão E Políticas Educacionais no contexto das TDIC,TECNOLOGIAS DIGITAIS NA ROTINA ESCOLAR E AS DIRETRIZES DO ESTADO: ENTRE CONVERGÊNCIAS E DIVERGÊNCIAS,"Apresentamos nesse artigo uma breve linha do tempo com a trajetória das tecnologias digitais na educação e para isso consideramos nos atentar as leis, decretos, portarias, publicações oficiais, ações e programas sobre a inclusão das tecnologias digitais na rotina escolar. Desse modo, analisamos os Projetos de Leis (PL) e suas ementas, que passam a simbolizar  os olhares e narrativas do Governo Federal sobre inserir a escola na cultura digital. O procedimento adotado foi a busca simples, através do site da Câmara dos Deputados, o qual fornece para consulta as propostas legislativas. A busca se deu através de palavras-chave. Após análise dos PLs do interesse deste estudo, selecionamos 32 propostas, apresentadas entre o período de 2003 a 2019, portanto período que antecedeu a pandemia de COVID-19 no Brasil. O objetivo foi analisar se o discurso do Estado estaria em consonância ou dissonância para com a realidade escolar. Concluímos por fim, que as leis que regem a temática Tecnologia e Educação são leis sem impacto para educação, sendo ainda repetição dos velhos discursos sob novas palavras.

", Tecnologia e Educação,Legislação Educacional,Tecnologias Digitais no Ensino,ND,ND
06/07/2023 18:42:52,Eixo Temático 4 - Gestão E Políticas Educacionais no contexto das TDIC,UMA PROPOSTA SOB A ÓPTICA DA GESTÃO EDUCACIONAL PARA A SUPERAÇÃO DE LACUNAS DE APRENDIZAGEM DE INGRESSANTES NO ENSINO MÉDIO MEDIADA POR TECNOLOGIAS DIGITAIS DE INFORMAÇÃO E COMUNICAÇÃO,"A gestão educacional sempre traz inúmeros desafios, recentemente potencializados com a implantação do ensino remoto emergencial devido à pandemia da COVID 19, sendo a busca por um ensino de qualidade frequentemente prejudicada pelas lacunas de aprendizagem nas mudanças de nível de ensino, sobretudo nos conhecimentos de língua portuguesa e matemática nos ingressantes do Ensino Médio; problema este que já saiu do chão de sala de aula para chegar no nível institucional, demandando alguma ação da equipe gestora das escolas. A partir deste contexto, foi elaborada uma proposta de plano de intervenção que envolve a toda a comunidade escolar do primeiro ano do ensino médio para reforço escolar de Língua Portuguesa e Matemática, consistindo na elaboração de uma matriz SWOT a fim de verificar os pontos fortes, fracos, oportunidades e ameaças ao projeto, sendo tais informações incluídas no plano de ação a ser implementado pela comunidade escolar. O projeto proposto aparentou ser de extrema relevância e com bastante viabilidade em escolas públicas e privadas dentro de suas especificidades, ainda que questões como a exclusão digital, a falta de tempo, problemas estruturais na unidade escolar e o eventual desinteresse de professores dessas disciplinas em engajar-se no projeto, por diversas razões possam atrapalhar a realização de um trabalho de qualidade, cabendo aos gestores escolares, a coordenação de esforços para a superação desses problemas.

",Plano  de  Intervenção,Base  Nacional  Comum  Curricular  e  Parâmetros Curriculares Nacionais,Tecnologias Digitais da Informação e da Comunicação na Educação,Ensino Médio, Gestão Educacional Integrada
